time_published,title,sentiment_score,sentiment_label,ticker
2025-11-20 14:00:05,"Investors Heavily Search First Solar, Inc.  ( FSLR ) : Here is What You Need to Know",0.239304,Somewhat-Bullish,FSLR
2025-11-18 18:26:00,Readying for Berkshire Hathaway Beyond Warren Buffett,0.104706,Neutral,FSLR
2025-11-17 18:32:26,Lithium Protests At COP30 Put Tesla And Albemarle Investors On Alert - Lithium Americas  ( NYSE:LAC ) ,0.08252,Neutral,FSLR
2025-11-17 13:01:00,How Is First Solar's Investment Strategy Powering Its Long-Term Growth?,0.415448,Bullish,FSLR
2025-11-14 16:42:40,What's Going On With First Solar Stock Friday? - First Solar  ( NASDAQ:FSLR ) ,0.299051,Somewhat-Bullish,FSLR
2025-11-13 18:45:00,First Solar Stock Rises 19.2% in a Month: What Should Investors Do?,0.300913,Somewhat-Bullish,FSLR
2025-11-13 15:45:00,"Canadian Solar Q3 Loss Narrower Than Estimates, Revenues Fall Y/Y",-0.00483,Neutral,FSLR
2025-11-11 19:08:46,Clean Energy's Second Wind: What iShares Global Clean Energy ETF Tells Us Now,0.388415,Bullish,FSLR
2025-11-10 13:31:00,WORKSPORT ANNOUNCES FINAL PRICING AND INITIAL MODEL LINEUP FOR SOLIS SOLAR TONNEAU COVER,0.186701,Somewhat-Bullish,FSLR
2025-11-07 13:39:00,Will Clean Energy ETFs Lose Momentum on Russia's REE Move?,0.275911,Somewhat-Bullish,FSLR
2025-11-07 12:17:31,"Two Solar Stocks Surge In Momentum Amid Insatiable AI Power Demand - First Solar  ( NASDAQ:FSLR ) , Canadian Solar  ( NASDAQ:CSIQ ) ",0.40417,Bullish,FSLR
2025-11-06 23:56:00,Should the Hype for First Solar  ( FLSR )  Stock Continue?,0.316515,Somewhat-Bullish,FSLR
2025-11-06 16:33:11,"Clean Energy ETFs Hit 52-Week Highs As Renewables Boom Continues - Bloom Energy  ( NYSE:BE ) , State Street SPDR S&P Kensho Clean Power ETF  ( ARCA:CNRG ) ",0.373252,Bullish,FSLR
2025-11-06 14:00:05,"Here is What to Know Beyond Why First Solar, Inc.  ( FSLR )  is a Trending Stock",0.250259,Somewhat-Bullish,FSLR
2025-11-06 13:28:00,"SolarEdge Technologies Q3 Earnings Top Estimates, Revenues Rise Y/Y",-0.0024,Neutral,FSLR
2025-11-06 12:35:00,Here's Why Solar & Clean Energy ETFs Are Shining Bright,0.164482,Somewhat-Bullish,FSLR
2025-11-05 22:15:48,"If You Invested $100 In First Solar Stock 10 Years Ago, You Would Have This Much Today - First Solar  ( NASDAQ:FSLR ) ",0.158543,Somewhat-Bullish,FSLR
2025-11-05 11:15:00,Comstock Metals Receives Solar Panel Processing Industrial Scale Written Determination,0.165865,Somewhat-Bullish,FSLR
2025-11-01 07:23:00,Clean Energy's Rally Is Outpacing AI's in 2025. Here Are 3 Renewable Energy Stocks to Buy Now.,0.368111,Bullish,FSLR
2025-10-31 19:39:00,Why First Solar Stock Jumped Higher Today,0.308513,Somewhat-Bullish,FSLR
2025-10-31 17:03:40,Why Are First Solar Shares Surging On Friday? - First Solar  ( NASDAQ:FSLR ) ,0.059684,Neutral,FSLR
2025-10-31 15:17:00,"First Solar Q3 Earnings Lag Estimates, Revenues Increase Y/Y",0.138134,Neutral,FSLR
2025-10-31 14:17:00,"First Solar Q3 Earnings Lag Estimates, Revenues Increase Y/Y",0.138134,Neutral,FSLR
2025-10-30 21:15:02,First Solar  ( FSLR )  Misses Q3 Earnings and Revenue Estimates,0.177699,Somewhat-Bullish,FSLR
2025-10-29 13:44:00,"Enphase Energy Q3 Earnings Beat Estimates, Revenues Rise Y/Y",0.129359,Neutral,FSLR
2025-10-28 21:11:00,First Quantum Minerals Reports Third Quarter 2025 Results,0.188498,Somewhat-Bullish,FSLR
2025-10-28 20:08:11,Corning  ( GLW )  Q3 2025 Earnings Call Transcript,0.311303,Somewhat-Bullish,FSLR
2025-10-27 13:16:00,First Solar to Release Q3 Earnings: Here's What You Need to Know,0.242222,Somewhat-Bullish,FSLR
2025-10-24 13:11:00,ONEOK Set to Report Q3 Earnings: Here's What You Need to Know,0.277703,Somewhat-Bullish,FSLR
2025-10-24 12:50:03,These 2 Oils and Energy Stocks Could Beat Earnings: Why They Should Be on Your Radar,0.390362,Bullish,FSLR
2025-10-23 14:00:05,First Solar  ( FSLR )  Earnings Expected to Grow: What to Know Ahead of Next Week's Release,0.172141,Somewhat-Bullish,FSLR
2025-10-22 21:45:04,Why First Solar  ( FSLR )  Dipped More Than Broader Market Today,0.154479,Somewhat-Bullish,FSLR
2025-10-22 13:31:46,"This Visa Analyst Begins Coverage On A Bullish Note; Here Are Top 5 Initiations For Wednesday - First Solar  ( NASDAQ:FSLR ) , Klaviyo  ( NYSE:KVYO ) ",0.161805,Somewhat-Bullish,FSLR
2025-10-22 13:23:00,Enphase Energy to Report Q3 Earnings: Here's What to Expect,0.189993,Somewhat-Bullish,FSLR
2025-10-18 16:49:14,"Got $10,000? 4 Top AI Grid Resilience Stocks to Buy That Could Double by 2030",-0.218753,Somewhat-Bearish,FSLR
2025-10-17 22:55:00,Meme Stocks and Luxury Cars,0.17372,Somewhat-Bullish,FSLR
2025-10-17 22:45:38,Here's How Much You Would Have Made Owning First Solar Stock In The Last 5 Years - First Solar  ( NASDAQ:FSLR ) ,0.158543,Somewhat-Bullish,FSLR
2025-10-17 09:17:00,"Zacks Investment Ideas feature highlights: First Solar, BMO Capital, Jefferies Financial and JPMorgan and Citigroup",0.330854,Somewhat-Bullish,FSLR
2025-10-17 06:30:00,Quadient Unveils First-of-Its-Kind Solar-Powered Autonomous Battery Parcel Locker,0.394693,Bullish,FSLR
2025-10-16 21:45:04,First Solar  ( FSLR )  Dips More Than Broader Market: What You Should Know,0.187671,Somewhat-Bullish,FSLR
2025-10-16 20:56:00,Buy the Surge in First Solar Stock Before It's Too Late?,0.328619,Somewhat-Bullish,FSLR
2025-10-15 15:20:00,Are Green ETFs in the Crosshairs? Navigating the Rare Earth Supply Shock,0.170791,Somewhat-Bullish,FSLR
2025-10-14 13:00:06,"Is Trending Stock First Solar, Inc.  ( FSLR )  a Buy Now?",0.221658,Somewhat-Bullish,FSLR
2025-10-14 12:50:04,How to Find Strong Oils and Energy Stocks Slated for Positive Earnings Surprises,0.418775,Bullish,FSLR
2025-10-13 20:39:00,Why GE Venova Stock Topped the Market Today,0.399388,Bullish,FSLR
2025-10-10 21:45:03,Here's Why First Solar  ( FSLR )  Fell More Than Broader Market,0.177197,Somewhat-Bullish,FSLR
2025-10-10 14:56:00,Zacks Investment Ideas feature highlights: First Solar,0.36371,Bullish,FSLR
2025-10-10 14:10:00,Enphase Expands IQ Energy Management to Include Water Heaters,0.532477,Bullish,FSLR
2025-10-09 12:00:00,Buy First Solar Stock Now for AI Energy Growth and Value,0.347059,Somewhat-Bullish,FSLR
2025-10-08 16:00:39,Here's How Much $1000 Invested In First Solar 10 Years Ago Would Be Worth Today - First Solar  ( NASDAQ:FSLR ) ,0.158543,Somewhat-Bullish,FSLR
