time_published,title,sentiment_score,sentiment_label,ticker
2025-11-20 18:01:26,Decoding Roblox's Options Activity: What's the Big Picture? - Roblox  ( NYSE:RBLX ) ,0.110663,Neutral,RBLX
2025-11-20 15:03:00,"RBLX Record Engagement, Record Users, Yet Margin Outlook Softens: Why?",0.395155,Bullish,RBLX
2025-11-20 00:00:00,Bitcoin futures traders refuse to capitulate even as BTC price drop to $89K,-0.082985,Neutral,RBLX
2025-11-19 16:37:00,Cathie Wood Goes Bargain Hunting: 3 Stocks She Just Bought,0.204002,Somewhat-Bullish,RBLX
2025-11-18 14:55:50,Roblox Is Locking Down Chat For Kids - Part Of A Bigger Cleanup? - Roblox  ( NYSE:RBLX ) ,0.20192,Somewhat-Bullish,RBLX
2025-11-14 16:50:30,This Fund Just Dumped $106 Million in Goodyear Stock Amid Major Restructuring Losses,0.239845,Somewhat-Bullish,RBLX
2025-11-14 13:30:00,"Amaze Reports Third Quarter 2025 Financial Results with 1,884% Year-Over-Year Revenue Growth",0.28099,Somewhat-Bullish,RBLX
2025-11-13 21:30:00,Super League Reports Third Quarter 2025 Financial Results,0.358914,Bullish,RBLX
2025-11-13 17:10:50,WEBTOON  ( WBTN )  Q3 2025 Earnings Call Transcript,0.236764,Somewhat-Bullish,RBLX
2025-11-13 15:50:00,Can Roblox's Expanding AI Infrastructure Power Its Next Growth Cycle?,0.325958,Somewhat-Bullish,RBLX
2025-11-13 14:57:13,"Elon Musk Says Delaware Is ""Bleeding Companies"" As Coinbase Moves To Texas - Coinbase Global  ( NASDAQ:COIN ) ",0.229413,Somewhat-Bullish,RBLX
2025-11-13 14:08:13,Why crypto's infrastructure hasn't caught up with its ideals,-0.102111,Neutral,RBLX
2025-11-12 14:57:16,Why One Fund Just Placed a New $142 Million Bet on NIO Stock,0.298309,Somewhat-Bullish,RBLX
2025-11-11 07:53:45,"'Western tech dominance fading,' Web Summit CEO says at 'Davos for geeks'",0.192549,Somewhat-Bullish,RBLX
2025-11-10 12:00:00,Top Toy Brand LITTLEST PET SHOP Signs Global YouTube Sensation - Hasbro  ( NASDAQ:HAS ) ,0.500685,Bullish,RBLX
2025-11-09 12:27:00,What Roblox Could Look Like in 5 Years,0.300253,Somewhat-Bullish,RBLX
2025-11-09 10:25:00,Best Stock to Buy Right Now: Carnival vs. Roblox,0.145599,Neutral,RBLX
2025-11-08 14:30:00,Why Everyone Is Talking About Roblox Stock Right Now,0.294634,Somewhat-Bullish,RBLX
2025-11-07 08:07:22,Texas AG Sues Roblox For Putting 'Pixel Pedophiles And Profit' Over Safety - Roblox  ( NYSE:RBLX ) ,0.027092,Neutral,RBLX
2025-11-05 18:14:18,Hudson Pacific  ( HPP )  Q3 2025 Earnings Transcript,0.25626,Somewhat-Bullish,RBLX
2025-11-05 14:46:10,"EXCLUSIVE: Teenage Millionaires Could Emerge From AI Agents Because 'AI Doesn't Have To Belong To Big Tech,' Olas Founder Tells - Roblox  ( NYSE:RBLX ) , Coinbase Global  ( NASDAQ:COIN ) ",0.189703,Somewhat-Bullish,RBLX
2025-11-05 13:02:33,Why Castle Biosciences' Rally Might Just Be Getting Started - Castle Biosciences  ( NASDAQ:CSTL ) ,0.234472,Somewhat-Bullish,RBLX
2025-11-04 18:01:54,Behind the Scenes of Roblox's Latest Options Trends - Roblox  ( NYSE:RBLX ) ,0.123967,Neutral,RBLX
2025-11-04 11:43:46,Roblox After Earnings: Game On Or Game Over? - Roblox  ( NYSE:RBLX ) ,-0.093598,Neutral,RBLX
2025-11-04 10:35:00,My 3 Favorite Stocks to Buy Right Now,0.263109,Somewhat-Bullish,RBLX
2025-11-03 12:45:00,4 Vanguard ETFs That Can Make a Well-Rounded Portfolio,0.308277,Somewhat-Bullish,RBLX
2025-11-03 06:30:00,2 Surprising Stocks That Are Turning AI Into Big Profits,0.563394,Bullish,RBLX
2025-11-02 09:21:00,1 Incredible Reason to Buy Roblox  ( RBLX )  Stock in November,0.50534,Bullish,RBLX
2025-10-31 19:21:00,Should You Buy Shopify Stock Ahead of Q3 Earnings Report?,0.337795,Somewhat-Bullish,RBLX
2025-10-31 16:03:01,"Roblox's Strong Results Impress, But 2026 Outlook Creates Uncertainty - Roblox  ( NYSE:RBLX ) ",0.304224,Somewhat-Bullish,RBLX
2025-10-30 18:01:05,Roblox Unusual Options Activity - Roblox  ( NYSE:RBLX ) ,0.063912,Neutral,RBLX
2025-10-30 15:40:13,Roblox stock slips 10% as company expects more spending on safety and infrastructure,0.050897,Neutral,RBLX
2025-10-30 15:02:16,Why Roblox Stock Sank Today,0.1415,Neutral,RBLX
2025-10-30 14:51:48,Why Is Roblox Stock Sinking Thursday? - Roblox  ( NYSE:RBLX ) ,0.124154,Neutral,RBLX
2025-10-30 14:51:18,Roblox Q3 2025 Earnings Call Transcript - Roblox  ( NYSE:RBLX ) ,0.322819,Somewhat-Bullish,RBLX
2025-10-30 13:30:02,"Roblox  ( RBLX )  Reports Q3 Loss, Beats Revenue Estimates",0.119334,Neutral,RBLX
2025-10-30 11:05:00,"transcosmos and Future Design Shibuya launch ""FIND THE HALLOWEEN SHIBUYA"" on Roblox",0.466817,Bullish,RBLX
2025-10-29 01:40:28,Cathie Wood Just Dumped More Palantir Shares Despite 'Holy Grail' AI Deal - Here's What Ark Bought Instead - Palantir Technologies  ( NASDAQ:PLTR ) ,0.419144,Bullish,RBLX
2025-10-28 17:41:00,Should Roku Stock Be in Your Portfolio Before the Q3 Earnings Release?,0.243302,Somewhat-Bullish,RBLX
2025-10-28 14:26:00,Roblox Gears Up to Report Q3 Earnings: What's in the Offing?,0.195448,Somewhat-Bullish,RBLX
2025-10-28 12:39:00,Balancing Innovation and Income: A2 Fund Shares 2026 Market Outlook Following 75% YTD Fund Growth,0.431503,Bullish,RBLX
2025-10-27 14:38:22,"Top Stocks With Earnings This Week: SoFi, Apple, Meta and More - SoFi Technologies  ( NASDAQ:SOFI ) ",0.129513,Neutral,RBLX
2025-10-27 14:28:56,The Rise Of AI-Powered Influencer Marketing: Key Trends For Investors,0.220952,Somewhat-Bullish,RBLX
2025-10-27 13:15:04,Roblox  ( RBLX )  Q3 Earnings Preview: What You Should Know Beyond the Headline Estimates,0.209616,Somewhat-Bullish,RBLX
2025-10-24 21:45:03,Roblox  ( RBLX )  Stock Drops Despite Market Gains: Important Facts to Note,0.170315,Somewhat-Bullish,RBLX
2025-10-24 13:15:30,"Amazon's Cloud Unit Issues Apology, Explains How Rare Software Bug Triggered Global AWS Outage This Week - Amazon.com  ( NASDAQ:AMZN ) , Walt Disney  ( NYSE:DIS ) ",-0.118181,Neutral,RBLX
2025-10-24 01:07:16,"Ark Invest Dumps AMD Stock, Doubles Down On Chinese Tech Giants Alibaba And Baidu - ARK Fintech Innovation ETF  ( BATS:ARKF ) , Advanced Micro Devices  ( NASDAQ:AMD ) ",0.31118,Somewhat-Bullish,RBLX
2025-10-23 14:00:22,Roblox  ( RBLX )  Expected to Beat Earnings Estimates: What to Know Ahead of Q3 Release,0.140206,Neutral,RBLX
2025-10-23 01:12:39,"Cathie Wood Bets $21 Million On Robinhood, Snaps Up Netflix, Sells These Two Hot AI Stocks - Robinhood Markets  ( NASDAQ:HOOD ) ",0.16856,Somewhat-Bullish,RBLX
2025-10-22 21:10:01,Churchill Downs  ( CHDN )  Q3 Earnings and Revenues Top Estimates,0.148411,Neutral,RBLX
