time_published,title,sentiment_score,sentiment_label,ticker
2025-11-20 14:15:03,What Analyst Projections for Key Metrics Reveal About Workday  ( WDAY )  Q3 Earnings,0.169909,Somewhat-Bullish,WDAY
2025-11-19 13:20:05,What's Going On With Workday Stock Wednesday? - Workday  ( NASDAQ:WDAY ) ,0.137995,Neutral,WDAY
2025-11-18 17:51:00,"Sea Limited Misses Q3 Estimates: Buy, Sell or Hold the Stock?",0.411684,Bullish,WDAY
2025-11-17 17:04:17,"Workday Stock Is 'Undervalued,' Poised For Growth: Analyst - Workday  ( NASDAQ:WDAY ) ",0.405736,Bullish,WDAY
2025-11-13 14:45:04,Why Workday  ( WDAY )  is a Top Growth Stock for the Long-Term,0.418343,Bullish,WDAY
2025-11-12 12:11:00,NOW Raises '25 Subscription Sales Outlook: Buy or Hold the Stock?,0.187095,Somewhat-Bullish,WDAY
2025-11-11 13:41:00,ASTS Reports Wider-Than-Expected Q3 Loss Despite Top-Line Expansion,0.007254,Neutral,WDAY
2025-11-10 18:00:00,TDS Q3 Earnings Beat Estimates on Solid Fiber Connection Growth,0.03574,Neutral,WDAY
2025-11-10 17:51:00,"Viasat Q2 Earnings Surpass Estimates, Revenues Increase Y/Y",0.152758,Somewhat-Bullish,WDAY
2025-11-07 17:44:00,"Akamai Q3 Earnings Surpass Estimates, Revenues Increase Y/Y",0.22131,Somewhat-Bullish,WDAY
2025-11-07 16:07:00,"OLED's Q3 Earnings Miss Estimates, Revenues Decline Y/Y",0.12428,Neutral,WDAY
2025-11-07 15:51:00,"Cogent Q3 Loss Narrower Than Expected, Revenues Decline Y/Y",0.0,Neutral,WDAY
2025-11-07 15:48:00,"Altice Q3 Earnings Miss Estimates, Revenues Decline Y/Y",0.098501,Neutral,WDAY
2025-11-05 16:16:00,Pinterest Q3 Earnings Miss Estimates Despite Y/Y Revenue Growth,0.344515,Somewhat-Bullish,WDAY
2025-11-05 13:11:00,Viasat Set to Report Q2 Results: Will Top-Line Growth Boost Earnings?,0.237559,Somewhat-Bullish,WDAY
2025-11-04 18:15:00,"Sanmina Q4 Earnings Surpass Estimates, Revenues Rise Y/Y",0.324194,Somewhat-Bullish,WDAY
2025-11-04 17:49:00,Lattice's Q3 Earnings Meet Estimates on Higher Revenues,0.228793,Somewhat-Bullish,WDAY
2025-11-04 16:50:00,"Qorvo Q2 Earnings Surpass Estimates, Revenues Rise Y/Y",0.25833,Somewhat-Bullish,WDAY
2025-11-04 14:53:22,Insperity  ( NSP )  Q3 2025 Earnings Call Transcript,0.265376,Somewhat-Bullish,WDAY
2025-11-03 16:43:00,PINS Set to Report Q3 Results: Will Revenue Growth Boost Earnings?,0.350149,Bullish,WDAY
2025-11-03 16:36:00,AKAM Set to Report Q3 Results: Will Top-Line Growth Boost Earnings?,0.279353,Somewhat-Bullish,WDAY
2025-10-31 13:30:02,Workday  ( WDAY )  Is Considered a Good Investment by Brokers: Is That True?,0.290797,Somewhat-Bullish,WDAY
2025-10-29 16:57:02,"What's Going On With Infosys Stock Wednesday? - Infosys  ( NYSE:INFY ) , Workday  ( NASDAQ:WDAY ) ",0.342745,Somewhat-Bullish,WDAY
2025-10-29 12:10:00,Buy 5 AI Laggards of 2025 to Tap Astonishing Growth Potential,0.384716,Bullish,WDAY
2025-10-28 21:01:02,A Look Into Workday Inc's Price Over Earnings - Workday  ( NASDAQ:WDAY ) ,0.007144,Neutral,WDAY
2025-10-28 13:45:04,Here's Why Workday  ( WDAY )  is a Strong Growth Stock,0.450271,Bullish,WDAY
2025-10-27 18:10:00,IDCC Set to Report Q3 Results: Will Revenue Growth Boost Earnings?,0.293111,Somewhat-Bullish,WDAY
2025-10-24 11:00:00,Bear of the Day: Paycom Software  ( PAYC ) ,-0.073573,Neutral,WDAY
2025-10-20 13:05:00,MSI Advances AI Native Public Safety Solution: Will it Boost Prospects?,0.474933,Bullish,WDAY
2025-10-16 13:00:00,"Flywire Expands Partnership with Workday, Integrates with Workday Student to Streamline Higher Education Payments around the World - Flywire  ( NASDAQ:FLYW ) ",0.272182,Somewhat-Bullish,WDAY
2025-10-15 12:27:00,NetApp Launches Enterprise-Grade Data Platform to Power AI Innovation,0.278494,Somewhat-Bullish,WDAY
2025-10-13 18:24:00,ServiceNow Drops 16% Year to Date: Should You Still Buy the Stock?,0.339254,Somewhat-Bullish,WDAY
2025-10-10 14:08:00,BlackBerry Expands SecuSUITE to Windows for Sovereign-Grade Security,0.386418,Bullish,WDAY
2025-10-10 12:02:00,5 Growth Stocks to Strengthen Your Portfolio in Q4 After a Fabulous Q3,0.415854,Bullish,WDAY
2025-10-09 13:00:02,The Zacks Rank Explained: How to Find Strong Buy Computer and Technology Stocks,0.320411,Somewhat-Bullish,WDAY
2025-10-09 12:59:00,5 Momentum Stocks to Buy for October After a Solid September,0.426526,Bullish,WDAY
2025-10-09 11:15:00,3 Artificial Intelligence  ( AI )  Stocks That Are Cheaper Than They Look,0.355501,Bullish,WDAY
2025-10-03 09:33:00,"The Zacks Analyst Blog Highlights Mitsubishi UFJ Financial Group, Workday and Ciena",0.048406,Neutral,WDAY
2025-10-02 13:05:00,Nokia Powers Data Center Connectivity in Singapore: Stock to Gain?,0.430602,Bullish,WDAY
2025-10-01 20:08:45,"These 2 Sectors Are Ripe For M&A Momentum In Q4 - M&T Bank  ( NYSE:MTB ) , Docusign  ( NASDAQ:DOCU ) ",0.1801,Somewhat-Bullish,WDAY
2025-10-01 13:25:00,Qorvo Expands Satcom Portfolio: Will This Boost Prospects?,0.411334,Bullish,WDAY
2025-09-30 13:40:00,MSI Boost Campus Safety at University of Palermo: Stock to Gain?,0.396878,Bullish,WDAY
2025-09-26 16:01:18,Behind the Scenes of Workday's Latest Options Trends - Workday  ( NASDAQ:WDAY ) ,0.120785,Neutral,WDAY
2025-09-26 15:30:05,Snowflake  ( SNOW )  Down 8.1% Since Last Earnings Report: Can It Rebound?,0.061183,Neutral,WDAY
2025-09-26 15:01:00,Top Stocks From the Staffing Services Industry to Buy Now,0.525504,Bullish,WDAY
2025-09-25 18:00:50,Is Workday Gaining or Losing Market Support? - Workday  ( NASDAQ:WDAY ) ,0.255112,Somewhat-Bullish,WDAY
2025-09-25 17:55:00,Jabil Q4 Earnings Surpass Estimates on Strong Revenue Growth,0.345162,Somewhat-Bullish,WDAY
2025-09-22 13:00:03,This Top Computer and Technology Stock is a #1  ( Strong Buy ) : Why It Should Be on Your Radar,0.339237,Somewhat-Bullish,WDAY
2025-09-19 16:50:00,Why Is Workday Stock Surging This Week?,0.290346,Somewhat-Bullish,WDAY
2025-09-18 13:50:03,Here's Why Workday  ( WDAY )  is a Strong Momentum Stock,0.317914,Somewhat-Bullish,WDAY
