time_published,title,sentiment_score,sentiment_label,ticker
2025-10-28 07:42:57,"iRobot Shares Fall 36% On Monday - What's Going On? - iRobot  ( NASDAQ:IRBT ) , Amazon.com  ( NASDAQ:AMZN ) ",-0.031744,Neutral,IRBT
2025-09-20 10:00:12,The US invented the robot vacuum. So why does China now dominate the market?,0.208595,Somewhat-Bullish,IRBT
2025-09-07 12:32:00,"Faruqi & Faruqi Reminds iRobot Corporation Investors of the Pending Class Action Lawsuit with a Lead Plaintiff Deadline of September 5, 2025 - IRBT - iRobot  ( NASDAQ:IRBT ) ",0.127629,Neutral,IRBT
2025-09-05 20:54:00,Shareholders that lost money on iRobot Corporation  ( IRBT )  should contact Levi & Korsinsky about pending Class Action - IRBT - iRobot  ( NASDAQ:IRBT ) ,0.022076,Neutral,IRBT
2025-09-04 20:40:00,"IROBOT FINAL DEADLINE ALERT: Bragar Eagel & Squire, P.C. Reminds Investors in IRobot  ( IRBT )  of the Class Action Lawsuit and Urges Investors To Contact the Firm Before September 5th - iRobot  ( NASDAQ:IRBT ) ",-0.099515,Neutral,IRBT
2025-09-04 19:50:17,Shareholders that lost money on iRobot Corporation ( IRBT )  Urged to Join Class Action - Contact The Gross Law Firm to Learn More - iRobot  ( NASDAQ:IRBT ) ,-0.103118,Neutral,IRBT
2025-09-03 17:48:00,The Problem With Weight Loss Stocks,0.081942,Neutral,IRBT
2025-09-03 16:08:00,"DEADLINE ALERT for IRBT and CNC: The Law Offices of Frank R. Cruz Reminds Investors of Class Actions on Behalf of Shareholders - Centene  ( NYSE:CNC ) , iRobot  ( NASDAQ:IRBT ) ",0.039081,Neutral,IRBT
2025-09-03 13:18:00,"DEADLINE ALERT: Faruqi & Faruqi, LLP Investigates Claims on Behalf of Investors of iRobot Corporation - iRobot  ( NASDAQ:IRBT ) ",0.127629,Neutral,IRBT
2025-09-02 21:00:00,"IROBOT DEADLINE ALERT: Bragar Eagel & Squire, P.C. Reminds Investors in IRobot  ( IRBT )  of the Class Action Lawsuit and Urges Investors To Contact the Firm Before September 5th - iRobot  ( NASDAQ:IRBT ) ",-0.099515,Neutral,IRBT
2025-09-02 19:52:02,"Contact Levi & Korsinsky by September 5, 2025 Deadline to Join Class Action Against iRobot Corporation ( IRBT )  - iRobot  ( NASDAQ:IRBT ) ",0.022076,Neutral,IRBT
2025-09-02 18:02:26,"IRBT DEADLINE: ROSEN, RECOGNIZED INVESTOR COUNSEL, Encourages iRobot Corporation Investors with Losses in Excess of $100K to Secure Counsel Before Important September 5 Deadline in Securities Class Action - IRBT - iRobot  ( NASDAQ:IRBT ) ",0.134169,Neutral,IRBT
2025-09-02 15:27:22,"INVESTOR ALERT: Holzer & Holzer, LLC Reminds Investors of September 5, 2025 Lead Plaintiff Deadline in the iRobot Corporation  ( IRBT )  Class Action - Investors With Significant Losses Encouraged to Contact the Firm - iRobot  ( NASDAQ:IRBT ) ",-0.002464,Neutral,IRBT
2025-08-31 12:30:00,"SHAREHOLDER REMINDER: Faruqi & Faruqi, LLP Investigates Claims on Behalf of Investors of iRobot Corporation",0.130489,Neutral,IRBT
2025-08-30 22:40:00,"IRBT DEADLINE NOTICE: ROSEN, GLOBAL INVESTOR COUNSEL, Encourages iRobot Corporation Investors to Secure Counsel Before Important September 5 Deadline in Securities Class Action - IRBT - iRobot  ( NASDAQ:IRBT ) ",0.134169,Neutral,IRBT
2025-08-30 12:01:00,"DEADLINE ALERT: Faruqi & Faruqi, LLP Investigates Claims on Behalf of Investors of iRobot Corporation",0.130489,Neutral,IRBT
2025-08-29 20:07:43,"iRobot Corporation Investors: Please contact the Portnoy Law Firm to recover your losses. September 5, 2025 Deadline to file Lead Plaintiff Motion - iRobot  ( NASDAQ:IRBT ) ",0.031678,Neutral,IRBT
2025-08-28 22:50:00,"SHAREHOLDER NOTICE: Faruqi & Faruqi, LLP Investigates Claims on Behalf of Investors of iRobot Corporation - iRobot  ( NASDAQ:IRBT ) ",0.118522,Neutral,IRBT
2025-08-28 20:46:00,Levi & Korsinsky Announces the Filing of a Securities Class Action on Behalf of iRobot Corporation ( IRBT )  Shareholders - iRobot  ( NASDAQ:IRBT ) ,0.022076,Neutral,IRBT
2025-08-28 17:09:15,"DEADLINE ALERT for IRBT, CNC, BHVN: Law Offices of Howard G. Smith Reminds Investors of Opportunity to Lead Securities Fraud Class Actions - Biohaven  ( NYSE:BHVN ) , Centene  ( NYSE:CNC ) ",0.019679,Neutral,IRBT
2025-08-27 20:33:00,iRobot Corporation Sued for Securities Law Violations - Investors Should Contact The Gross Law Firm for More Information - IRBT - iRobot  ( NASDAQ:IRBT ) ,-0.103118,Neutral,IRBT
2025-08-27 16:58:00,"IRBT DEADLINE: ROSEN, A TOP-RANKED FIRM, Encourages iRobot Corporation Investors with Losses in Excess of $100K to Secure Counsel Before Important September 5 Deadline in Securities Class Action - IRBT - iRobot  ( NASDAQ:IRBT ) ",0.134169,Neutral,IRBT
2025-08-26 19:39:42,"iRobot Corporation Investors: Please contact the Portnoy Law Firm to recover your losses. September 5, 2025 Deadline to file Lead Plaintiff Motion - iRobot  ( NASDAQ:IRBT ) ",0.031678,Neutral,IRBT
2025-08-25 21:24:46,Levi & Korsinsky Notifies Shareholders of iRobot Corporation ( IRBT )  of a Class Action Lawsuit and an Upcoming Deadline - iRobot  ( NASDAQ:IRBT ) ,0.022076,Neutral,IRBT
2025-08-25 14:23:00,"DEADLINE ALERT for HIMS, IRBT, and CNC: The Law Offices of Frank R. Cruz Reminds Investors of Class Actions on Behalf of Shareholders - Hims & Hers Health  ( NYSE:HIMS ) , Centene  ( NYSE:CNC ) ",-0.012253,Neutral,IRBT
2025-08-24 22:36:00,"IRBT IMPORTANT DEADLINE: ROSEN, LEADING TRIAL ATTORNEYS, Encourages iRobot Corporation Investors with Losses in Excess of $100K to Secure Counsel Before Important Deadline in Securities Class Action - IRBT - iRobot  ( NASDAQ:IRBT ) ",0.134169,Neutral,IRBT
2025-08-24 14:01:00,"IRBT FINAL DEADLINE: ROSEN, A TOP RANKED LAW FIRM, Encourages iRobot Corporation Investors with Losses in Excess of $100K to Secure Counsel Before Important Deadline in Securities Class Action - IRBT",0.151019,Somewhat-Bullish,IRBT
2025-08-22 20:37:00,"iRobot Corporation Class Action: Levi & Korsinsky Reminds iRobot Corporation Investors of the Pending Class Action Lawsuit with a Lead Plaintiff Deadline of September 5, 2025 - IRBT - iRobot  ( NASDAQ:IRBT ) ",0.022076,Neutral,IRBT
2025-08-22 16:00:00,"DEADLINE ALERT for HIMS, IRBT, CNC, BHVN: Law Offices of Howard G. Smith Reminds Investors of Opportunity to Lead Securities Fraud Class Actions - Biohaven  ( NYSE:BHVN ) , Centene  ( NYSE:CNC ) ",-0.00495,Neutral,IRBT
2025-08-22 01:44:00,"IRBT DEADLINE NOTICE: ROSEN, TOP RANKED GLOBAL COUNSEL, Encourages iRobot Corporation Investors with Losses in Excess of $100K to Secure Counsel Before Important Deadline in Securities Class Action - IRBT - iRobot  ( NASDAQ:IRBT ) ",0.134169,Neutral,IRBT
2025-08-21 14:12:00,Pomerantz Law Firm Announces the Filing of a Class Action Against iRobot Corporation and Certain Officers - IRBT - iRobot  ( NASDAQ:IRBT ) ,0.058767,Neutral,IRBT
2025-08-19 21:01:35,"iRobot Corporation Investors: Please contact the Portnoy Law Firm to recover your losses. September 5, 2025 Deadline to file Lead Plaintiff Motion. - iRobot  ( NASDAQ:IRBT ) ",0.031678,Neutral,IRBT
2025-08-18 23:15:00,"IRBT DEADLINE: ROSEN, GLOBAL INVESTOR COUNSEL, Encourages iRobot Corporation Investors with Losses in Excess of $100K to Secure Counsel Before Important Deadline in Securities Class Action - IRBT - iRobot  ( NASDAQ:IRBT ) ",0.134169,Neutral,IRBT
2025-08-18 11:40:57,"Alert for Long-Term Shareholders of Flywire Corporation  ( NASDAQ: FLYW ) ; Ibotta, Inc.  ( NYSE: IBTA ) ; iRobot Corporation  ( NASDAQ: IRBT ) ; and SelectQuote, Inc.  ( NYSE: SLQT ) ; Grabar Law Office is Investigating Claims on Your Behalf - Flywire  ( NASDAQ:FLYW ) , Ibotta  ( NYSE:IBTA ) ",0.169981,Somewhat-Bullish,IRBT
2025-08-17 13:07:00,"Faruqi & Faruqi Reminds iRobot Corporation Investors of the Pending Class Action Lawsuit with a Lead Plaintiff Deadline of September 5, 2025 - IRBT",0.123787,Neutral,IRBT
2025-08-16 11:14:00,"SHAREHOLDER REMINDER: Faruqi & Faruqi, LLP Investigates Claims on Behalf of Investors of iRobot Corporation - iRobot  ( NASDAQ:IRBT ) ",0.118522,Neutral,IRBT
2025-08-15 21:46:41,"IRBT DEADLINE: ROSEN, A LEADING LAW FIRM, Encourages iRobot Corporation Investors with Losses in Excess of $100K to Secure Counsel Before Important Deadline in Securities Class Action - IRBT - iRobot  ( NASDAQ:IRBT ) ",0.134169,Neutral,IRBT
2025-08-12 13:43:00,"SHAREHOLDER ACTION REMINDER: Faruqi & Faruqi, LLP Investigates Claims on Behalf of Investors of iRobot Corporation - iRobot  ( NASDAQ:IRBT ) ",0.127629,Neutral,IRBT
2025-08-11 16:00:00,Deadline Alert: iRobot Corporation  ( IRBT )  Investors Who Lost Money Urged To Contact Glancy Prongay & Murray LLP About Securities Fraud Lawsuit - iRobot  ( NASDAQ:IRBT ) ,0.039128,Neutral,IRBT
2025-08-09 21:56:00,"ROSEN, A RANKED AND LEADING LAW FIRM, Encourages iRobot Corporation Investors to Secure Counsel Before Important Deadline in Securities Class Action - IRBT - iRobot  ( NASDAQ:IRBT ) ",0.134169,Neutral,IRBT
2025-08-09 14:20:00,Pomerantz Law Firm Announces the Filing of a Class Action Against iRobot Corporation and Certain Officers - IRBT - iRobot  ( NASDAQ:IRBT ) ,0.058767,Neutral,IRBT
2025-08-08 20:17:34,Lost Money on iRobot Corporation ( IRBT ) ? Join Class Action Suit Seeking Recovery - Contact Levi & Korsinsky - iRobot  ( NASDAQ:IRBT ) ,0.022076,Neutral,IRBT
2025-08-08 17:51:06,"DEADLINE ALERT for HIMS, IRBT, CNC, BHVN: Law Offices of Howard G. Smith Reminds Investors of Opportunity to Lead Securities Fraud Class Actions - Biohaven  ( NYSE:BHVN ) , Centene  ( NYSE:CNC ) ",-0.00495,Neutral,IRBT
2025-08-07 14:30:09,iRobot  ( IRBT )  Loss Narrows Sales Beat,-0.034138,Neutral,IRBT
2025-08-06 18:26:53,"ROSEN, A RANKED AND LEADING LAW FIRM, Encourages iRobot Corporation Investors to Secure Counsel Before Important Deadline in Securities Class Action - IRBT - iRobot  ( NASDAQ:IRBT ) ",0.134169,Neutral,IRBT
2025-08-05 23:33:00,"Bragar Eagel & Squire, P.C. Reminds Investors in IRobot  ( IRBT )  of the Class Action Lawsuit and Encourages Investors to Inquire About Their Rights - iRobot  ( NASDAQ:IRBT ) ",-0.08742,Neutral,IRBT
2025-08-05 16:11:00,"DEADLINE ALERT for RDDT, HIMS, IRBT, and CNC: The Law Offices of Frank R. Cruz Reminds Investors of Class Actions on Behalf of Shareholders - Hims & Hers Health  ( NYSE:HIMS ) , Centene  ( NYSE:CNC ) ",-0.01209,Neutral,IRBT
2025-08-05 15:41:00,Should You Buy or Hold SharkNinja Stock Before Q2 Earnings?,0.311228,Somewhat-Bullish,IRBT
2025-08-05 14:41:00,"DEADLINE ALERT: Faruqi & Faruqi, LLP Investigates Claims on Behalf of Investors of iRobot Corporation - iRobot  ( NASDAQ:IRBT ) ",0.120723,Neutral,IRBT
2025-08-04 23:03:00,"iRobot Corporation Investors: Please contact the Portnoy Law Firm to recover your losses. September 5, 2025 Deadline to file Lead Plaintiff Motion - iRobot  ( NASDAQ:IRBT ) ",0.043719,Neutral,IRBT
