time_published,title,sentiment_score,sentiment_label,ticker
2025-11-19 15:06:39,"The Biotech Sector is Seeing a Major Boost From Programmable Cell Therapies in Chronic Disease Care - Avant Technologies  ( OTC:AVAI ) , CRISPR Therapeutics  ( NASDAQ:CRSP ) ",0.203498,Somewhat-Bullish,SANA
2025-11-18 13:48:00,Top 3 Genomics Stocks to Consider for Your Portfolio,0.201482,Somewhat-Bullish,SANA
2025-11-12 17:00:03,All You Need to Know About Sana  ( SANA )  Rating Upgrade to Buy,0.305539,Somewhat-Bullish,SANA
2025-11-10 12:12:22,"Quantum Computer That Could 'Hack Everyone's Crypto': Why Eric Jackson Is Betting On BTQ Technologies As His Next 100-Bagger - CrowdStrike Holdings  ( NASDAQ:CRWD ) , BTQ Technologies  ( NASDAQ:BTQ ) ",0.047981,Neutral,SANA
2025-10-15 16:15:41,Sana Biotech Stock - The Next '100-Bagger'? - Sana Biotechnology  ( NASDAQ:SANA ) ,0.178467,Somewhat-Bullish,SANA
2025-10-15 14:47:54,"Morgan Stanley, T1 Energy, Bunge Global, Bank of America And Other Big Stocks Moving Higher On Wednesday - Bank of America  ( NYSE:BAC ) , Applied Digital  ( NASDAQ:APLD ) ",0.344054,Somewhat-Bullish,SANA
2025-09-24 18:35:36,"This Riot Platforms Analyst Begins Coverage On A Bullish Note; Here Are Top 5 Initiations For Wednesday - Vita Coco  ( NASDAQ:COCO ) , Kyivstar Group  ( NASDAQ:KYIV ) ",0.270428,Somewhat-Bullish,SANA
2025-09-10 11:00:00,CAMP4 Announces an Oversubscribed Private Placement of up to $100 Million to Advance First-in-Class Treatment for SYNGAP1-Related Disorders,0.0786,Neutral,SANA
2025-09-04 11:00:00,Hinge Bio Expands Leadership Team to Drive Clinical Development of GEM-DIMER™ Programs and Announces Publication in Scientific Reports,0.053036,Neutral,SANA
2025-08-26 20:05:00,Sana Biotechnology to Present at September 2025 Investor Conferences,0.068586,Neutral,SANA
2025-08-20 20:05:00,Sana Biotechnology Announces Closing of Full Exercise of Underwriters' Option to Purchase Additional Shares - Sana Biotechnology  ( NASDAQ:SANA ) ,0.155301,Somewhat-Bullish,SANA
2025-08-20 20:05:00,Sana Biotechnology Announces Closing of Full Exercise of Underwriters' Option to Purchase Additional Shares,0.160065,Somewhat-Bullish,SANA
2025-08-07 18:15:47,"Dow Dips Over 300 Points; US Initial Claims Rise - Aveanna Healthcare Hldgs  ( NASDAQ:AVAH ) , Brilliant Earth Group  ( NASDAQ:BRLT ) ",0.16244,Somewhat-Bullish,SANA
2025-08-07 14:28:45,"Nasdaq Surges Over 150 Points; ConocoPhillips Earnings Top Estimates - Bit Origin  ( NASDAQ:BTOG ) , Brilliant Earth Group  ( NASDAQ:BRLT ) ",0.253241,Somewhat-Bullish,SANA
2025-08-07 12:14:08,"Redwire Posts Downbeat Q2 Results, Joins Tandem Diabetes Care, Fortinet, Symbotic And Other Big Stocks Moving Lower In Thursday's Pre-Market Session - ADMA Biologics  ( NASDAQ:ADMA ) , Airbnb  ( NASDAQ:ABNB ) ",-0.094442,Neutral,SANA
2025-08-07 03:24:08,Sana Biotechnology Announces Pricing of Public Offering - Sana Biotechnology  ( NASDAQ:SANA ) ,0.159222,Somewhat-Bullish,SANA
2025-08-07 03:24:00,Sana Biotechnology Announces Pricing of Public Offering,0.159394,Somewhat-Bullish,SANA
2025-08-06 20:38:00,Sana Biotechnology Announces Proposed Public Offering of Common Stock and Pre-Funded Warrants,0.163442,Somewhat-Bullish,SANA
2025-07-14 13:54:26,"How To Trade This 150% Gainer Chasing A Cure For Type 1 Diabetes - Eli Lilly  ( NYSE:LLY ) , DexCom  ( NASDAQ:DXCM ) ",0.140025,Neutral,SANA
2025-06-23 15:08:07,"Kroger Posts Better-Than-Expected Earnings, Joins Couchbase, CarMax And Other Big Stocks Moving Higher On Friday - Circle Internet Group  ( NYSE:CRCL ) , AIRO Group Holdings  ( NASDAQ:AIRO ) ",0.27642,Somewhat-Bullish,SANA
2025-06-23 14:05:00,Sana Biotechnology Announces Positive Six-Month Clinical Results from Type 1 Diabetes Study of Islet Cell Transplantation Without Immunosuppression,0.188441,Somewhat-Bullish,SANA
2025-06-23 11:39:03,"Two Biotech Stocks Poised For Big Moves On Monday - Lineage Cell Therapeutics  ( AMEX:LCTX ) , Roche Holding  ( OTC:RHHBY ) ",0.155069,Somewhat-Bullish,SANA
2025-06-09 20:05:00,Sana Biotechnology Announces Invited Oral Presentation at the 85th Annual American Diabetes Association Scientific Sessions,0.075822,Neutral,SANA
2025-06-09 20:05:00,Sana Biotechnology Announces Invited Oral Presentation at the 85th Annual American Diabetes Association Scientific Sessions - Sana Biotechnology  ( NASDAQ:SANA ) ,0.104061,Neutral,SANA
2025-05-28 20:05:00,Sana Biotechnology to Present at June 2025 Investor Conferences - Sana Biotechnology  ( NASDAQ:SANA ) ,0.101775,Neutral,SANA
2025-05-28 20:05:00,Sana Biotechnology to Present at June 2025 Investor Conferences,0.073476,Neutral,SANA
2025-05-19 15:57:46,"The End Of The Diabetes Industry? - Eli Lilly  ( NYSE:LLY ) , DexCom  ( NASDAQ:DXCM ) ",0.164564,Somewhat-Bullish,SANA
2025-05-18 12:17:00,"Investors in Sana Biotechnology, Inc.  ( SANA ) : Protect Your Rights - Contact Levi & Korsinsky Before May 20, 2025",-0.029604,Neutral,SANA
2025-05-18 12:13:00,"SANA Investors Have the Opportunity to Lead the Sana Biotechnology Securities Fraud Lawsuit with Faruqi & Faruqi, LLP - Sana Biotechnology  ( NASDAQ:SANA ) ",0.170507,Somewhat-Bullish,SANA
2025-05-18 12:12:00,"SANA DEADLINE NOTICE: ROSEN, TOP RANKED GLOBAL COUNSEL, Encourages Sana Biotechnology, Inc. Investors with Losses in Excess of $100K to Secure Counsel Before Important May 20 Deadline in Securities...",0.150312,Somewhat-Bullish,SANA
2025-05-17 11:49:00,"ONGOING DEADLINE ALERT: Faruqi & Faruqi, LLP Investigates Claims on Behalf of Investors of Sana Biotechnology",0.161411,Somewhat-Bullish,SANA
2025-05-16 17:12:00,"Sana Biotechnology, Inc. Class Action: Levi & Korsinsky Reminds Sana Biotechnology, Inc. Investors of the Pending Class Action Lawsuit with a Lead Plaintiff Deadline of May 20, 2025 - SANA - Sana Biotechnology  ( NASDAQ:SANA ) ",0.046265,Neutral,SANA
2025-05-15 17:55:00,"May 20, 2025 Deadline: Contact The Gross Law Firm to Join Class Action Suit Against SANA - Sana Biotechnology  ( NASDAQ:SANA ) ",-0.061343,Neutral,SANA
2025-05-14 18:50:51,"INVESTOR DEADLINE APPROACHING: Faruqi & Faruqi, LLP Investigates Claims on Behalf of Investors of Sana Biotechnology - Sana Biotechnology  ( NASDAQ:SANA ) ",0.166328,Somewhat-Bullish,SANA
2025-05-11 13:40:00,"Faruqi & Faruqi Reminds Sana Biotechnology Investors of the Pending Class Action Lawsuit with a Lead Plaintiff Deadline of May 20, 2025 - SANA - Sana Biotechnology  ( NASDAQ:SANA ) ",0.166328,Somewhat-Bullish,SANA
2025-05-11 11:13:00,"Sana Biotechnology, Inc. Sued for Securities Law Violations - Contact Levi & Korsinsky Before May 20, 2025 to Discuss Your Rights - SANA",-0.029604,Neutral,SANA
2025-05-07 16:30:00,"Sana Biotechnology, Inc. Sued for Securities Law Violations - Investors Should Contact The Gross Law Firm for More Information - SANA - Sana Biotechnology  ( NASDAQ:SANA ) ",-0.061343,Neutral,SANA
2025-05-04 20:00:00,"SANA INVESTOR ALERT: Bronstein, Gewirtz & Grossman LLC Announces that Sana Biotechnology, Inc. Investors with Substantial Losses Have Opportunity to Lead Class Action Lawsuit - Sana Biotechnology  ( NASDAQ:SANA ) ",0.017085,Neutral,SANA
2025-04-30 20:18:46,"ROSEN, A TRUSTED AND LEADING LAW FIRM, Encourages Sana Biotechnology, Inc. Investors to Secure Counsel Before Important Deadline in Securities Class Action - SANA - Sana Biotechnology  ( NASDAQ:SANA ) ",0.147849,Neutral,SANA
2025-04-27 20:00:00,"SANA INVESTOR ALERT: Bronstein, Gewirtz & Grossman LLC Announces that Sana Biotechnology, Inc. Investors with Substantial Losses Have Opportunity to Lead Class Action Lawsuit - Sana Biotechnology  ( NASDAQ:SANA ) ",0.017085,Neutral,SANA
2025-04-26 14:42:00,"INVESTOR ALERT: Faruqi & Faruqi, LLP Investigates Claims on Behalf of Investors of Sana Biotechnology - Sana Biotechnology  ( NASDAQ:SANA ) ",0.170507,Somewhat-Bullish,SANA
2025-04-24 16:24:00,"Levi & Korsinsky Reminds Sana Biotechnology, Inc. Investors of the Pending Class Action Lawsuit with a Lead Plaintiff Deadline of May 20, 2025 - SANA - Sana Biotechnology  ( NASDAQ:SANA ) ",0.046265,Neutral,SANA
2025-04-21 19:44:08,"ROSEN, A RANKED AND LEADING FIRM, Encourages Sana Biotechnology, Inc. Investors to Secure Counsel Before Important Deadline in Securities Class Action - SANA - Sana Biotechnology  ( NASDAQ:SANA ) ",0.147849,Neutral,SANA
2025-04-20 12:32:00,"DEADLINE ALERT: Faruqi & Faruqi, LLP Investigates Claims on Behalf of Investors of Sana Biotechnology - Sana Biotechnology  ( NASDAQ:SANA ) ",0.166328,Somewhat-Bullish,SANA
2025-04-18 16:51:00,"Lost Money on Sana Biotechnology, Inc. ( SANA ) ? Join Class Action Suit Seeking Recovery - Contact Levi & Korsinsky - Sana Biotechnology  ( NASDAQ:SANA ) ",0.046265,Neutral,SANA
2025-04-18 12:30:00,"Shareholders of Sana Biotechnology, Inc. Should Contact Levi & Korsinsky Before May 20, 2025 to Discuss Your Rights - SANA",-0.029604,Neutral,SANA
2025-04-17 16:56:00,"Contact The Gross Law Firm by May 20, 2025 Deadline to Join Class Action Against Sana Biotechnology, Inc.  ( SANA )  - Sana Biotechnology  ( NASDAQ:SANA ) ",-0.061343,Neutral,SANA
2025-04-16 14:34:55,"Sana Biotechnology, Inc. Investors: Please contact the Portnoy Law Firm to recover your losses. May 20, 2025 Deadline to file Lead Plaintiff Motion. - Sana Biotechnology  ( NASDAQ:SANA ) ",0.03407,Neutral,SANA
2025-04-15 22:06:00,"ROSEN, TRUSTED INVESTOR COUNSEL, Encourages Sana Biotechnology, Inc. Investors to Secure Counsel Before Important Deadline in Securities Class Action - SANA - Sana Biotechnology  ( NASDAQ:SANA ) ",0.147849,Neutral,SANA
2025-04-13 20:00:00,"SANA INVESTOR ALERT: Bronstein, Gewirtz & Grossman LLC Announces that Sana Biotechnology, Inc. Investors with Substantial Losses Have Opportunity to Lead Class Action Lawsuit - Sana Biotechnology  ( NASDAQ:SANA ) ",0.017081,Neutral,SANA
