time_published,title,sentiment_score,sentiment_label,ticker
2025-11-18 12:15:00,The Three Best Bets in the Hydrogen Industry and Why They Stand to Make a Fortune,0.292211,Somewhat-Bullish,LIN
2025-11-13 15:45:54,Here's How Much $100 Invested In Linde 10 Years Ago Would Be Worth Today - Linde  ( NASDAQ:LIN ) ,0.158543,Somewhat-Bullish,LIN
2025-11-10 21:30:42,Here's How Much You Would Have Made Owning Linde Stock In The Last 20 Years - Linde  ( NASDAQ:LIN ) ,0.158543,Somewhat-Bullish,LIN
2025-11-05 18:11:00,"International Flavors Earnings Beat Estimates in Q3, Sales Dip Y/Y",0.037862,Neutral,LIN
2025-10-31 18:02:00,Linde Q3 Earnings & Revenues Top Estimates on Higher Americas Pricing,0.250573,Somewhat-Bullish,LIN
2025-10-31 14:55:26,Linde Q3 2025 Earnings Call Transcript,0.21249,Somewhat-Bullish,LIN
2025-10-31 11:05:02,Linde  ( LIN )  Q3 Earnings and Revenues Top Estimates,0.155004,Somewhat-Bullish,LIN
2025-10-28 20:01:31,What's Driving the Market Sentiment Around Linde PLC? - Linde  ( NASDAQ:LIN ) ,0.250562,Somewhat-Bullish,LIN
2025-10-28 19:05:00,Linde Gears Up to Report Q3 Earnings: What's in the Offing?,0.200334,Somewhat-Bullish,LIN
2025-10-28 14:00:31,Analysts Estimate Ashland  ( ASH )  to Report a Decline in Earnings: What to Look Out for,0.105201,Neutral,LIN
2025-10-27 08:02:00,"Meet the Spectacular Index Fund That Could Turn $200,000 Into $1 Million in Under 20 Years",0.246926,Somewhat-Bullish,LIN
2025-10-24 14:00:05,Linde  ( LIN )  Reports Next Week: Wall Street Expects Earnings Growth,0.130833,Neutral,LIN
2025-10-22 15:40:03,SYIEY vs. LIN: Which Stock Should Value Investors Buy Now?,0.483752,Bullish,LIN
2025-10-20 22:45:29,"If You Invested $1000 In Linde Stock 20 Years Ago, You Would Have This Much Today - Linde  ( NASDAQ:LIN ) ",0.158543,Somewhat-Bullish,LIN
2025-10-15 13:30:00,"Hydrogen Energy Storage Market Revenue to Hit USD 196.8 Billion by 2028, Growing at a CAGR of 76.8% - Report by MarketsandMarkets™",0.366462,Bullish,LIN
2025-09-29 12:00:00,CSX Corp. Announces Leadership Transition,0.378963,Bullish,LIN
2025-09-29 10:20:02,Should You Invest in the Fidelity MSCI Materials Index ETF  ( FMAT ) ?,0.216389,Somewhat-Bullish,LIN
2025-09-24 20:45:28,"If You Invested $1000 In Linde Stock 10 Years Ago, You Would Have This Much Today - Linde  ( NASDAQ:LIN ) ",0.160819,Somewhat-Bullish,LIN
2025-09-18 23:30:26,Here's How Much You Would Have Made Owning Linde Stock In The Last 10 Years - Linde  ( NASDAQ:LIN ) ,0.181243,Somewhat-Bullish,LIN
2025-09-16 08:59:00,"The Zacks Analyst Blog Highlights Roche, Linde, Disney and Vaso",0.139006,Neutral,LIN
2025-09-15 20:16:00,"Top Analyst Reports for Roche, Linde & Walt Disney",0.147284,Neutral,LIN
2025-09-12 13:18:00,"Stock Market News for Sep 12, 2025",0.043412,Neutral,LIN
2025-09-03 14:45:23,$100 Invested In Linde 20 Years Ago Would Be Worth This Much Today - Linde  ( NASDAQ:LIN ) ,0.181243,Somewhat-Bullish,LIN
2025-08-25 16:00:31,How Do Investors Really Feel About Linde? - Linde  ( NASDAQ:LIN ) ,0.243722,Somewhat-Bullish,LIN
2025-08-25 13:45:00,"The Zacks Analyst Blog Highlights NVIDIA, Cisco and Linde",0.225578,Somewhat-Bullish,LIN
2025-08-19 15:30:20,"If You Invested $100 In This Stock 10 Years Ago, You Would Have This Much Today - Linde  ( NASDAQ:LIN ) ",0.181243,Somewhat-Bullish,LIN
2025-08-15 16:02:00,IFF Launches POWERFRESH ACE 2000 to Enhance Bread Sustainability,0.368158,Bullish,LIN
2025-08-13 10:20:02,Should Invesco S&P 500 Low Volatility ETF  ( SPLV )  Be on Your Investing Radar?,0.060052,Neutral,LIN
2025-08-06 16:55:00,"International Flavors Q2 Earnings Beat Estimates, Sales Dip Y/Y",0.070667,Neutral,LIN
2025-08-06 14:27:38,Linde  ( LIN )  Q2 2025 Earnings Call Transcript,0.258808,Somewhat-Bullish,LIN
2025-08-05 17:50:48,Linde Q2 EPS Up 6%,0.280251,Somewhat-Bullish,LIN
2025-08-01 16:56:59,"Stocks Sell Off, Gold Rallies On Tariff Turmoil, Weak Jobs Data: What's Moving Markets Friday? - Apple  ( NASDAQ:AAPL ) ",-0.014611,Neutral,LIN
2025-08-01 15:06:00,Linde Q2 Earnings & Revenues Beat on Higher Americas Pricing,0.301178,Somewhat-Bullish,LIN
2025-08-01 11:15:02,Linde  ( LIN )  Q2 Earnings and Revenues Beat Estimates,0.159691,Somewhat-Bullish,LIN
2025-07-29 22:15:01,Ashland  ( ASH )  Q3 Earnings and Revenues Miss Estimates,0.116893,Neutral,LIN
2025-07-29 14:00:24,Earnings Preview: International Flavors  ( IFF )  Q2 Earnings Expected to Decline,0.123915,Neutral,LIN
2025-07-29 13:46:00,Linde Gears Up to Report Q2 Earnings: What's in Store for the Stock?,0.170925,Somewhat-Bullish,LIN
2025-07-29 13:15:04,Linde  ( LIN )  Q2 Earnings on the Horizon: Analysts' Insights on Key Performance Measures,0.210541,Somewhat-Bullish,LIN
2025-07-29 10:20:02,Should You Invest in the Fidelity MSCI Materials Index ETF  ( FMAT ) ?,0.21025,Somewhat-Bullish,LIN
2025-07-25 23:00:00,5 Dividend Stocks to Hold for the Next 20 Years,-0.03244,Neutral,LIN
2025-07-25 14:00:05,Linde  ( LIN )  Earnings Expected to Grow: What to Know Ahead of Next Week's Release,0.160879,Somewhat-Bullish,LIN
2025-07-24 22:10:01,Minerals Technologies  ( MTX )  Beats Q2 Earnings Estimates,0.160181,Somewhat-Bullish,LIN
2025-07-23 12:50:02,Want Better Returns? Don't Ignore These 2 Basic Materials Stocks Set to Beat Earnings,0.385592,Bullish,LIN
2025-07-22 13:58:00,Linde Expands Industrial Gas Capacity to Support U.S. Space Sector,0.302193,Somewhat-Bullish,LIN
2025-07-18 22:30:20,$1000 Invested In This Stock 20 Years Ago Would Be Worth This Much Today - Linde  ( NASDAQ:LIN ) ,0.164255,Somewhat-Bullish,LIN
2025-07-09 10:20:05,Should You Invest in the iShares U.S. Basic Materials ETF  ( IYM ) ?,0.161516,Somewhat-Bullish,LIN
2025-07-03 16:10:02,Will Linde  ( LIN )  Beat Estimates Again in Its Next Earnings Report?,0.314924,Somewhat-Bullish,LIN
2025-07-03 12:50:09,These 2 Basic Materials Stocks Could Beat Earnings: Why They Should Be on Your Radar,0.380475,Bullish,LIN
2025-07-02 12:50:07,How to Boost Your Portfolio with Top Basic Materials Stocks Set to Beat Earnings,0.395406,Bullish,LIN
2025-06-25 20:15:36,"If You Invested $1000 In This Stock 20 Years Ago, You Would Have This Much Today - Linde  ( NASDAQ:LIN ) ",0.25,Somewhat-Bullish,LIN
